Shampoo - Lavender - Andalou Naturals,20,Pites,6ares,Fruit stem cell complex and lavender gently refresh
Conditioner - Jasmin & Wild Cherry - Zatik Naturals,20,Pites,6ares,A mild creamy conditioner with hair detangling attributes
"Dish Soap - Bergamot, Olive Further",10,Pites,6ares,Refreshing lavender thyme delights the senses as superfruit antioxidants
"Hand Soap - Bergamot, Olive Further",10,Pites,mpougatsakia,Further hand soap will leave your hands feeling squeaky clean
"Laundry Detergent - Lavender, Grapefruit - Better Life",15,Pites,mpougatsakia,This ultra concentrated detergent dissolves dirt and stains
"Dish Soap - Bergamot, Olive Further",10,Pites,mpougatsakia,"It has a signature fragrance made from oils of bergamot, olive, and exotic grasses"
